{
 "schema": 1,
 "writer": "page",
 "at": "2026-10-12T23:10:00Z",
 "source": "E.V. · Oct 12",
 "topic": "Made-up pump rate topic",
 "objective": "E9-2",
 "exam": "E9",
 "course": "NUR 112",
 "kind": "concept",
 "addedBy": "page",
 "origin": {
  "set": "review-2026-10-12",
  "item": "q3",
  "at": "2026-10-12T23:10:00Z"
 },
 "initial": {
  "streak": 0,
  "nextDue": "2026-10-13",
  "recurrence": 1,
  "misses": 0
 },
 "events": {
  "page-20261014-010000": {
   "type": "solid",
   "by": "owner",
   "at": "2026-10-14T01:00:00Z"
  },
  "evening-cloud-20261015-011500": {
   "type": "seen",
   "by": "E.V.",
   "note": "Missed again",
   "at": "2026-10-15T01:15:00Z"
  }
 }
}